{
  "version": "2.2-operativ",
  "korrespondierender_laufzettel_betreff": "Termux Meisterkurs – Quellcode- und Inhaltsstruktur (Analyse aus fragment02)",
  "art_des_inhalts": "Kurs-Quellcode- und Inhaltsstruktur",
  "fokus_domaene": "Termux; Pentesting; Linux; Fahrzeugdiagnostik; Automatisierung",
  "kanonische_referenz_id": "fragment02-termux-meisterkurs",
  "metadata_des_pakets": {
    "datum_iso8601": "2025-08-18T01:38:54+02:00",
    "projektname": "Termux Meisterkurs",
    "teilnehmer": [
      "EliteDax",
      "KI-Agent"
    ],
    "ursprung": "Freitext-Fragment aus datenfagment/fragment02.txt",
    "version_des_protokolls": "1.0"
  },
  "haupt_inhalt": {
    "sitzungs_zusammenfassung_text": "Strukturierte Übersicht (Kapitel, Tools, Ziele, Kern-Beispiele) des 'Termux Meisterkurses' sowie exemplarische Snippets (Bash, Struktur-JSON, Markdown).",
    "detaillierte_struktur_json": {
      "kapitel": [
        "Grundlegendes über Termux",
        "10 Schritte nach der Installation",
        "Grundlagen für Hacking und Pentesting",
        "Hacking-System: Grundlagen und Anwendungen",
        "Fahrzeugdiagnostik",
        "Sicherheit der Datenübertragung",
        "Fahrzeugwartung und Reparatur",
        "Automatisierungstechniken",
        "Ausblick"
      ],
      "beispiele": {
        "bash_basis": "sudo apt update && sudo apt upgrade -y",
        "vpn_setup_hinweis": "Implementierung/Konfiguration eines VPN-Servers in Termux (OpenVPN/Wireguard)",
        "netzwerk_scan": "Automatisierung eines Netzwerk-Scans (nmap)"
      }
    },
    "quellcode_artefakte": [
      {
        "dateiname": "setup.sh",
        "sprache": "bash",
        "zweck": "Basis-Update Schritt",
        "code": "sudo apt update && sudo apt upgrade -y"
      }
    ],
    "referenzen": [
      {
        "url": "https://github.com/tekkDAX/von-gedanken-zu-welten",
        "beschreibung": "Projekt-Referenz (falls öffentlich)"
      }
    ],
    "zusatz_informationen": "Freitext-Hinweise und Meta-Aspekte aus dem Fragment; IGNORE_WHEN_COPYING*-Marker deuten auf Kopierhinweise hin."
  }
}
